Ronny Lorenz	RNAwolf	0.4.0.0	Extended RNA secondary structure predictions	http://www.tbi.univie.ac.at/software/rnawolf/rnawolf.html	TBI	RNA secondary structure	Tool	Extended RNA secondary structure predictions	RNA secondary structure prediction | RNA extended secondary structure prediction	Command line	http://www.tbi.univie.ac.at/software/rnawolf/rnawolf.html			TBI	Christian Höner zu Siederdissen	choener@tbi.univie.ac.at	Scientific	Ivo L. Hofacker	ivo@tbi.univie.ac.at	scientific	RNA Sequence	Text	Secondary Structure Constraint	Dot-bracket format	Extended Nucleic Acid Secondary Structure				Extended secondary structure following the Leontis-Westhoff annotation of base pairs	21685061
Ronny Lorenz	RNAlocmin	2.0.0	Generate locally minimal secondary structures including pseudoknots	http://www.tbi.univie.ac.at/~marcel/BHG/RNAlocmin.html	TBI	RNA secondary structure	Tool	Generate locally minimal secondary structures including pseudoknots	RNA secondary structure prediction	Command line	http://www.tbi.univie.ac.at/~marcel/BHG/RNAlocmin.html			TBI	Marcel Kucharík	marcel@tbi.univie.ac.at	Scientific	Ivo L. Hofacker	ivo@tbi.univie.ac.at	scientific	RNA Sequence	Text,FASTA			Multiple Nucleic Acid Secondary Structures				Set of suboptimal secondary structures (local minima)	
Florian Eggenhofer	Bcheck	1.0.0	Bcheck is a wrapper tool for rnpB gene prediction by combining speed of rnabob descriptor model and sensitivity of infernal covariance model.	http://rna.tbi.univie.ac.at/bcheck/	TBI	RNA Homology Search	Tool	Bcheck is a wrapper tool for rnpB gene prediction by combining speed of rnabob descriptor model and sensitivity of infernal covariance model.	RNA homology search	Web UI	http://rna.tbi.univie.ac.at/bcheck/			TBI	Dilmurat Yusuf	dilmurat@tbi.univie.ac.at	Scientific	Ivo L. Hofacker	ivo@tbi.univie.ac.at	scientific	RNA sequence	FASTA			Nucleotide Acid Sequence, Nucleotide Acid Secondary Structure	Bcheck Output Format			Hit sequence, relative coordinates to input and predicted secondary structure	
Florian Eggenhofer	AREsite	2.0.0	Database for AU-rich elements and direct evidence for Interaction and lifetime regulation	http://rna.tbi.univie.ac.at/AREsite2	TBI	RNA Protein Interaction	Database	Database for AU-rich elements and direct evidence for Interaction and lifetime regulation		Web UI	http://rna.tbi.univie.ac.at/AREsite2			TBI	Jörg Fallmann	fall@tbi.univie.ac.at	Scientific	Ivo L. Hofacker	ivo@tbi.univie.ac.at	scientific	Nucleotide Sequence	Text	Organism	Text	Genomic coordinates	html-table, CSV			Genomic coordinates, structural accessibility and alignment information for motif	21071424
Florian Eggenhofer	Vienna Atlas of Viral RNA Structures	1.0.0	Atlas of Viral RNA Structures	http://rna.tbi.univie.ac.at/virus/	TBI	RNA secondary structure	Database	Atlas of Viral RNA Structures		Web UI	http://rna.tbi.univie.ac.at/virus/			TBI	Roman Stocsits	roman.stocsits@imp.ac.at	Scientific	Ivo L. Hofacker	ivo@tbi.univie.ac.at	scientific	Genomic Coordinates	Text			Nucleic Acid Secondary Structure Drawing	PS, PNG			Secondary structure plot	
Florian Eggenhofer	RNAxs webserver	1.0.0	Design potent siRNAs to knock down your gene(s) of interest	http://rna.tbi.univie.ac.at/cgi-bin/RNAxs	TBI	RNA secondary structure	Webservice	Design potent siRNAs to knock down your gene(s) of interest.	RNA sequence design	Web UI	http://rna.tbi.univie.ac.at/cgi-bin/RNAxs			TBI	Hakim Tafer	htafer@tbi.univie.ac.at	Scientific	Ivo L. Hofacker	ivo@tbi.univie.ac.at	scientific	RNA Sequence	FASTA			Multiple Nucleotide Sequences	FASTA	RNA structural accessibility plot	PS	List of designed siRNA sequences and accessiblity change plots	18438400